{
  "schema_version": "goe-0.1",
  "engine_result": {
    "engine": "full-spectrum-engine",
    "version": "v1.3.0",
    "run_id": "run_logistics_001"
  },
  "risk_vector": {
    "dimensions": [
      "survival",
      "coordination",
      "meaning"
    ],
    "values": [
      0.81,
      0.62,
      0.38
    ]
  },
  "safety_action": "human_review_required",
  "enterprise_writeback": {
    "schema_version": "ew-0.1",
    "case_status": "human_review_required",
    "allow_auto_reply": false,
    "allow_commitment": false,
    "allow_auto_execution": false,
    "human_review_required": true,
    "safety_action": "human_review_required",
    "risk_level": "high",
    "reason_code": "LOGISTICS_EVIDENCE_INCOMPLETE",
    "recommended_response": "冷链证据不完整，需人工核验温控记录后再确认交付状态。",
    "audit_id": "audit_logistics_001",
    "review_role": "logistics_quality_supervisor",
    "review_queue": "cold_chain_review",
    "relationships": [
      {
        "relation_type": "derived_from",
        "target_type": "output_envelope",
        "target_id": "run_logistics_001"
      },
      {
        "relation_type": "audited_by",
        "target_type": "audit",
        "target_id": "audit_logistics_001"
      }
    ],
    "subject_ref": {
      "id": "none",
      "mode": "none",
      "declaration_id": "none",
      "digest": "none",
      "external_effect": false
    }
  },
  "privacy": {
    "public_shareable": false
  },
  "conformance": {
    "schema_valid": true
  },
  "audit_references": [
    "audit_logistics_001"
  ],
  "policy_evaluation": {
    "policy_id": "fsp-governance-chain-default",
    "policy_version": "1.0.0",
    "policy_source": "full-spectrum-engine governance-chain baseline",
    "approved_by": "project-maintainer",
    "matched_rule_id": "logistics-evidence-gap"
  },
  "relationships": [
    {
      "relation_type": "evaluates",
      "target_type": "canonical_context",
      "target_id": "cc_logistics_coldchain_001"
    },
    {
      "relation_type": "uses",
      "target_type": "cell_manifest",
      "target_id": "logistics_ai_001"
    }
  ],
  "subject_ref": {
    "id": "none",
    "mode": "none",
    "declaration_id": "none",
    "digest": "none",
    "external_effect": false
  }
}
